<?xml version="1.0" encoding="UTF-8"?>
<tns:patient xmlns:tns="http://www.example.org/Test"
	xmlns:xsi="http://www.w3.org/2001/XMLSchema-instance"
	xsi:schemaLocation="http://www.example.org/Test Test.xsd ">
	<tns:name>xxx</tns:name>
	<tns:age>0</tns:age>
	<tns:gender>M</tns:gender>
	<tns:dob>2001-01-01</tns:dob>
	<tns:email>tns:email</tns:email>
	<tns:phone>0</tns:phone>
	
	<tns:payment>
		<tns:insurence>
			<tns:provider>djfhd</tns:provider>
			<tns:limit>434</tns:limit>
		</tns:insurence>
	</tns:payment>
</tns:patient>
